{
  "$schema": "./learning-catalog.schema.json",
  "problemTags": [
    {
      "id": "collection-traversal",
      "label": "集合遍历",
      "aliases": [
        "迭代",
        "惰性序列",
        "不暴露集合"
      ]
    },
    {
      "id": "interface-integration",
      "label": "接口不兼容",
      "aliases": [
        "旧接口",
        "第三方接口",
        "协议适配",
        "单位转换"
      ]
    },
    {
      "id": "algorithm-variation",
      "label": "算法经常变化",
      "aliases": [
        "运行时切换",
        "流程变化",
        "规则替换"
      ]
    },
    {
      "id": "object-creation",
      "label": "对象创建",
      "aliases": [
        "延迟创建",
        "复杂构建",
        "产品族",
        "克隆"
      ]
    },
    {
      "id": "state-transition",
      "label": "状态转换",
      "aliases": [
        "状态机",
        "生命周期",
        "非法转换"
      ]
    },
    {
      "id": "notification-coordination",
      "label": "通知与协调",
      "aliases": [
        "发布订阅",
        "事件",
        "对象协作",
        "中介"
      ]
    },
    {
      "id": "undo-recovery",
      "label": "撤销与恢复",
      "aliases": [
        "undo",
        "redo",
        "快照",
        "历史"
      ]
    },
    {
      "id": "access-control",
      "label": "访问控制",
      "aliases": [
        "权限",
        "代理",
        "缓存",
        "延迟加载"
      ]
    },
    {
      "id": "tree-structure",
      "label": "树形结构",
      "aliases": [
        "层级",
        "叶子",
        "容器",
        "对象树"
      ]
    },
    {
      "id": "dynamic-responsibility",
      "label": "动态叠加职责",
      "aliases": [
        "包装",
        "装饰",
        "组合顺序"
      ]
    },
    {
      "id": "request-pipeline",
      "label": "请求处理流水线",
      "aliases": [
        "审批链",
        "校验链",
        "逐级处理"
      ]
    },
    {
      "id": "multi-axis-extension",
      "label": "多维度独立扩展",
      "aliases": [
        "组合爆炸",
        "抽象与实现",
        "自由组合"
      ]
    },
    {
      "id": "simplify-subsystem",
      "label": "简化复杂子系统",
      "aliases": [
        "统一入口",
        "用例入口",
        "编排"
      ]
    },
    {
      "id": "stable-structure-operations",
      "label": "稳定结构增加操作",
      "aliases": [
        "访问者",
        "双分派",
        "增加操作"
      ]
    },
    {
      "id": "memory-sharing",
      "label": "大量对象内存复用",
      "aliases": [
        "享元",
        "共享状态",
        "内在状态"
      ]
    },
    {
      "id": "small-dsl",
      "label": "小型 DSL",
      "aliases": [
        "解释器",
        "表达式树",
        "语法"
      ]
    },
    {
      "id": "single-lifecycle",
      "label": "唯一生命周期",
      "aliases": [
        "单例",
        "全局实例",
        "惰性初始化"
      ]
    }
  ],
  "patterns": [
    {
      "key": "iterator",
      "scenario": "播放列表按曲序遍历，并用另一种迭代方式筛选收藏曲目。",
      "source": "src/DesignPatterns/Behavioral/IteratorDemo.cs",
      "practice": "examples/DocumentWorkflow/Domain/SectionCollection.cs",
      "practiceLabel": "DocumentWorkflow · 章节集合",
      "guide": "#31-第-1-章-iterator迭代器一个一个遍历",
      "problemTags": [
        "collection-traversal"
      ],
      "changeAxis": "集合的内部表示与遍历方式彼此独立变化。",
      "whenUse": "自定义容器需要多种遍历、惰性序列或隐藏内部结构时。",
      "avoidWhen": "普通集合已经能用 foreach 或 LINQ 清楚表达时，不要再包一层。",
      "related": [
        "visitor",
        "composite"
      ]
    },
    {
      "key": "adapter",
      "scenario": "把旧式华氏温度设备适配为新系统使用的摄氏温度传感器。",
      "source": "src/DesignPatterns/Structural/AdapterDemo.cs",
      "practice": "examples/SmartHome/Patterns/Structural/LegacyAirConditionerAdapter.cs",
      "practiceLabel": "SmartHome · 旧空调接入",
      "guide": "#32-第-2-章-adapter适配器填平接口与单位差异",
      "problemTags": [
        "interface-integration"
      ],
      "changeAxis": "外部协议变化被隔离在系统边界，核心业务继续依赖稳定接口。",
      "whenUse": "接入遗留代码、第三方 SDK、不同协议或单位体系时。",
      "avoidWhen": "双方接口都能直接修改，或包装只会复制同名方法而没有形成边界时。",
      "related": [
        "bridge",
        "facade",
        "proxy"
      ]
    },
    {
      "key": "template-method",
      "scenario": "统一 CSV 与 JSON 订单导出的骨架，只让格式相关步骤发生变化。",
      "source": "src/DesignPatterns/Behavioral/TemplateMethodDemo.cs",
      "practice": "examples/DocumentWorkflow/Pipeline/PublishingPipeline.cs",
      "practiceLabel": "DocumentWorkflow · 发布流水线",
      "guide": "#41-第-3-章-template-method模板方法父类守住流程",
      "problemTags": [
        "algorithm-variation"
      ],
      "changeAxis": "稳定的流程骨架与少量可覆写步骤分离。",
      "whenUse": "流程顺序和前后条件必须统一守住，而个别步骤允许子类变化时。",
      "avoidWhen": "只有一两个可替换步骤，组合 Strategy 或委托会更直接时。",
      "related": [
        "strategy",
        "factory-method"
      ]
    },
    {
      "key": "factory-method",
      "scenario": "公路与航空运输工作流分别创建合适的承运商。",
      "source": "src/DesignPatterns/Creational/FactoryMethodDemo.cs",
      "practice": "examples/OnlineStore/Payments/PaymentProcessorCreator.cs",
      "practiceLabel": "OnlineStore · 支付处理器创建",
      "guide": "#42-第-4-章-factory-method工厂方法把创建哪一种留给子类",
      "problemTags": [
        "object-creation"
      ],
      "changeAxis": "通用流程与具体产品类型的选择分离。",
      "whenUse": "父类掌握流程，但子类应决定实例化哪一种产品时。",
      "avoidWhen": "只需在组合根根据配置创建对象，一个简单工厂函数已经足够时。",
      "related": [
        "abstract-factory",
        "builder",
        "template-method"
      ]
    },
    {
      "key": "singleton",
      "scenario": "用线程安全的惰性实例提供不可变应用设置。",
      "source": "src/DesignPatterns/Creational/SingletonDemo.cs",
      "practice": "examples/SmartHome/Patterns/Creational/DeviceTypeRegistry.cs",
      "practiceLabel": "SmartHome · 设备类型注册表",
      "guide": "#51-第-5-章-singleton单例先问生命周期再写全局入口",
      "problemTags": [
        "single-lifecycle",
        "object-creation"
      ],
      "changeAxis": "实例生命周期与调用者访问方式被集中管理。",
      "whenUse": "进程内确实只能有一个无状态或不可变协调对象，且生命周期边界明确时。",
      "avoidWhen": "可变全局状态会隐藏依赖、污染测试或跨请求共享时。",
      "related": [
        "factory-method",
        "facade"
      ]
    },
    {
      "key": "prototype",
      "scenario": "复制营销活动模板，并验证可变渠道集合已经深复制。",
      "source": "src/DesignPatterns/Creational/PrototypeDemo.cs",
      "practice": "examples/DocumentWorkflow/Domain/ReportDocument.cs",
      "practiceLabel": "DocumentWorkflow · 报表深克隆",
      "guide": "#52-第-6-章-prototype原型复制的是值还是共享引用",
      "problemTags": [
        "object-creation"
      ],
      "changeAxis": "昂贵初始化与后续按模板复制分离。",
      "whenUse": "创建成本高、配置复杂，且从现有对象复制比重新构建更清楚时。",
      "avoidWhen": "对象持有文件句柄、事件订阅等无法安全复制的资源时。",
      "related": [
        "builder",
        "flyweight"
      ]
    },
    {
      "key": "builder",
      "scenario": "用流畅步骤创建通过校验的预览版与生产版部署计划。",
      "source": "src/DesignPatterns/Creational/BuilderDemo.cs",
      "practice": "examples/OnlineStore/Building/OrderBuilder.cs",
      "practiceLabel": "OnlineStore · 合法订单构建",
      "guide": "#53-第-7-章-builder建造者让复杂对象只能以合法方式完成",
      "problemTags": [
        "object-creation"
      ],
      "changeAxis": "复杂对象的构建过程与最终表示分离。",
      "whenUse": "构造参数很多、存在必填组合或需要分步校验时。",
      "avoidWhen": "对象只有少量清晰参数，普通构造函数或工厂方法更容易理解时。",
      "related": [
        "factory-method",
        "abstract-factory",
        "prototype"
      ]
    },
    {
      "key": "abstract-factory",
      "scenario": "一次切换 Windows 与移动端的按钮、输入框等兼容控件族。",
      "source": "src/DesignPatterns/Creational/AbstractFactoryDemo.cs",
      "practice": "examples/DocumentWorkflow/Output/OutputComponentFactories.cs",
      "practiceLabel": "DocumentWorkflow · 输出产品族",
      "guide": "#54-第-8-章-abstract-factory抽象工厂一次选择一整套兼容产品",
      "problemTags": [
        "object-creation"
      ],
      "changeAxis": "产品族的整体选择与具体产品的使用分离。",
      "whenUse": "客户端必须一次获得相互兼容的一组产品时。",
      "avoidWhen": "只有一个产品维度，或产品族并不存在兼容性约束时。",
      "related": [
        "factory-method",
        "builder"
      ]
    },
    {
      "key": "bridge",
      "scenario": "让告警类型与 Email、SMS 发送渠道独立扩展和自由组合。",
      "source": "src/DesignPatterns/Structural/BridgeDemo.cs",
      "practice": "examples/SmartHome/Patterns/Structural/BridgeDevices.cs",
      "practiceLabel": "SmartHome · 设备与通信通道",
      "guide": "#61-第-9-章-bridge桥接不要为每种组合建立子类",
      "problemTags": [
        "multi-axis-extension"
      ],
      "changeAxis": "抽象维度与实现维度分别扩展，避免子类组合爆炸。",
      "whenUse": "两个正交维度都在变化，并且需要运行时自由组合时。",
      "avoidWhen": "只有一个变化维度，额外抽象会比直接组合更难理解时。",
      "related": [
        "adapter",
        "strategy"
      ]
    },
    {
      "key": "strategy",
      "scenario": "在标准、加急和自提柜配送报价之间动态切换。",
      "source": "src/DesignPatterns/Behavioral/StrategyDemo.cs",
      "practice": "examples/OnlineStore/Pricing/PricingStrategies.cs",
      "practiceLabel": "OnlineStore · 定价算法",
      "guide": "#62-第-10-章-strategy策略整体替换算法",
      "problemTags": [
        "algorithm-variation"
      ],
      "changeAxis": "可替换算法与使用算法的上下文分离。",
      "whenUse": "同一业务目标存在多套算法，需要独立测试或运行时选择时。",
      "avoidWhen": "只有一个纯函数或简单条件，接口层次会掩盖真实逻辑时。",
      "related": [
        "state",
        "template-method",
        "bridge"
      ]
    },
    {
      "key": "composite",
      "scenario": "工作分解树用同一接口表示任务和任务组，并自动汇总工时。",
      "source": "src/DesignPatterns/Structural/CompositeDemo.cs",
      "practice": "examples/SmartHome/Patterns/Structural/HomeComposite.cs",
      "practiceLabel": "SmartHome · 家庭设备树",
      "guide": "#71-第-11-章-composite组合让叶子和容器共享协议",
      "problemTags": [
        "tree-structure"
      ],
      "changeAxis": "单个对象与对象组合共享统一协议。",
      "whenUse": "领域天然形成树形结构，客户端应一致处理叶子和容器时。",
      "avoidWhen": "叶子与容器行为差异很大，强行统一会制造大量无意义方法时。",
      "related": [
        "decorator",
        "iterator",
        "visitor"
      ]
    },
    {
      "key": "decorator",
      "scenario": "在房价上依次叠加会员折扣、服务费和税，观察顺序影响。",
      "source": "src/DesignPatterns/Structural/DecoratorDemo.cs",
      "practice": "examples/DocumentWorkflow/Output/ArtifactDecorators.cs",
      "practiceLabel": "DocumentWorkflow · 水印签名审计",
      "guide": "#72-第-12-章-decorator装饰器按顺序叠加职责",
      "problemTags": [
        "dynamic-responsibility"
      ],
      "changeAxis": "核心职责与可按顺序组合的附加职责分离。",
      "whenUse": "需要在运行时叠加缓存、审计、费用或格式等横切行为时。",
      "avoidWhen": "包装顺序难以说明，或少量固定组合用显式流程更清楚时。",
      "related": [
        "proxy",
        "composite",
        "chain-of-responsibility"
      ]
    },
    {